{
  "$id": "https://local.codex/post-office-next/contracts/v1/operations/capabilityRequest.fulfil.request.schema.json",
  "$schema": "http://json-schema.org/draft-07/schema#",
  "additionalProperties": false,
  "examples": [
    {
      "actor": {
        "id": "PON-ACTOR-001",
        "kind": "HUMAN",
        "role": "browser-after-integration"
      },
      "aggregate": {
        "expectedVersion": 0,
        "id": "PON-AGGREGATE-001",
        "type": "Example"
      },
      "authority": {
        "authorityGrantId": "PON-GRANT-001",
        "capabilityId": "PON-CAPABILITY-001"
      },
      "operation": "capabilityRequest.fulfil",
      "parameters": {
        "capabilityRequestId": "PON-EXAMPLE-001",
        "evidenceRoots": [
          "sha256:aaaaaaaaaaaaaaaaaaaaaaaaaaaaaaaaaaaaaaaaaaaaaaaaaaaaaaaaaaaaaaaa"
        ],
        "outcome": "FULFILLED"
      },
      "requestId": "PON-REQUEST-001",
      "schemaVersion": "1"
    }
  ],
  "properties": {
    "actor": {
      "additionalProperties": false,
      "properties": {
        "id": {
          "minLength": 1,
          "pattern": "^[A-Za-z][A-Za-z0-9._:-]{2,127}$",
          "type": "string"
        },
        "kind": {
          "enum": [
            "HUMAN",
            "BROWSER",
            "COURIER",
            "ENDPOINT",
            "SYSTEM"
          ],
          "minLength": 1,
          "type": "string"
        },
        "role": {
          "minLength": 1,
          "type": "string"
        }
      },
      "required": [
        "id",
        "kind",
        "role"
      ],
      "type": "object"
    },
    "aggregate": {
      "additionalProperties": false,
      "anyOf": [
        {
          "required": [
            "expectedVersion"
          ]
        },
        {
          "required": [
            "expectedRoot"
          ]
        }
      ],
      "properties": {
        "expectedRoot": {
          "minLength": 1,
          "pattern": "^(?:sha256:)?[0-9a-f]{64}$",
          "type": "string"
        },
        "expectedVersion": {
          "minimum": 0,
          "type": "integer"
        },
        "id": {
          "minLength": 1,
          "pattern": "^[A-Za-z][A-Za-z0-9._:-]{2,127}$",
          "type": "string"
        },
        "type": {
          "minLength": 1,
          "type": "string"
        }
      },
      "required": [
        "type",
        "id"
      ],
      "type": "object"
    },
    "authority": {
      "oneOf": [
        {
          "additionalProperties": false,
          "properties": {
            "authorityGrantId": {
              "minLength": 1,
              "pattern": "^[A-Za-z][A-Za-z0-9._:-]{2,127}$",
              "type": "string"
            },
            "capabilityId": {
              "minLength": 1,
              "pattern": "^[A-Za-z][A-Za-z0-9._:-]{2,127}$",
              "type": "string"
            },
            "exactAuthorActionId": {
              "minLength": 1,
              "pattern": "^[A-Za-z][A-Za-z0-9._:-]{2,127}$",
              "type": "string"
            }
          },
          "required": [
            "capabilityId",
            "authorityGrantId"
          ],
          "type": "object"
        },
        {
          "additionalProperties": false,
          "properties": {
            "authorityGrantId": {
              "minLength": 1,
              "pattern": "^[A-Za-z][A-Za-z0-9._:-]{2,127}$",
              "type": "string"
            },
            "capabilityId": {
              "minLength": 1,
              "pattern": "^[A-Za-z][A-Za-z0-9._:-]{2,127}$",
              "type": "string"
            },
            "exactAuthorActionId": {
              "minLength": 1,
              "pattern": "^[A-Za-z][A-Za-z0-9._:-]{2,127}$",
              "type": "string"
            }
          },
          "required": [
            "capabilityId",
            "exactAuthorActionId"
          ],
          "type": "object"
        }
      ]
    },
    "operation": {
      "const": "capabilityRequest.fulfil"
    },
    "parameters": {
      "additionalProperties": false,
      "properties": {
        "capabilityRequestId": {
          "minLength": 1,
          "pattern": "^[A-Za-z][A-Za-z0-9._:-]{2,127}$",
          "type": "string"
        },
        "evidenceRoots": {
          "items": {
            "minLength": 1,
            "pattern": "^(?:sha256:)?[0-9a-f]{64}$",
            "type": "string"
          },
          "minItems": 1,
          "type": "array"
        },
        "outcome": {
          "enum": [
            "FULFILLED",
            "PARTIAL",
            "WITHDRAWN"
          ],
          "minLength": 1,
          "type": "string"
        }
      },
      "required": [
        "capabilityRequestId",
        "outcome",
        "evidenceRoots"
      ],
      "type": "object"
    },
    "requestId": {
      "minLength": 1,
      "pattern": "^[A-Za-z][A-Za-z0-9._:-]{2,127}$",
      "type": "string"
    },
    "schemaVersion": {
      "const": "1"
    }
  },
  "required": [
    "schemaVersion",
    "operation",
    "requestId",
    "actor",
    "authority",
    "parameters",
    "aggregate"
  ],
  "title": "capabilityRequest.fulfil request",
  "type": "object",
  "x-contractStatus": "CONTRACT_ONLY",
  "x-minimumAuthority": "browser-after-integration",
  "x-mutates": true
}
